{
  "$schema": "../../../node_modules/@wraithlight/tools.schema/dist/swagger.schema.json",
  "openapi": "3.0.3",
  "info": {
    "title": "Swagger Latency - OpenAPI 3.0",
    "description": "Swagger file for wraithlight's latency controller V1.",
    "version": "1.0.0"
  },
  "servers": [
    {
      "url": "http://local.auth.wraithlight.ai:4500",
      "description": "local"
    },
    {
      "url": "http://dev.auth.wraithlight.ai:5500",
      "description": "dev"
    },
    {
      "url": "http://test.auth.wraithlight.ai",
      "description": "test"
    },
    {
      "url": "http://staging.auth.wraithlight.ai",
      "description": "staging"
    },
    {
      "url": "http://auth.wraithlight.ai",
      "description": "prod"
    }
  ],
  "tags": [
    {
      "name": "common/latency",
      "description": "Endpoints that are related to latency entity."
    }
  ],
  "paths": {
    "/api/v1/latency": {
      "get": {
        "operationId": "getLatency",
        "summary": "Endpoint that returns the latency.",
        "tags": [
          "common/latency"
        ],
        "parameters": [],
        "responses": {
          "200": {
            "description": "The operation was successful.",
            "content": {
              "application/json": {
                "schema": {
                  "type": "object",
                  "properties": {
                    "correlationId": {
                      "type": "string",
                      "format": "uuid",
                      "example": "bb3a7a80-44ec-4b74-9b7b-c8cd58f777b3"
                    },
                    "error": {
                      "type": "object",
                      "properties": {
                        "code": {
                          "type": "string",
                          "example": ""
                        }
                      }
                    },
                    "payload": {
                      "type": "object",
                      "properties": {
                        "receivedAtUtc": {
                          "type": "string",
                          "format": "datetime",
                          "example": "2024-09-29T10:55:45.889Z"
                        }
                      }
                    }
                  }
                }
              }
            }
          },
          "500": {
            "description": "Internal server error.",
            "content": {
              "application/json": {
                "schema": {
                  "$ref": "#/components/schemas/error500"
                }
              }
            }
          }
        }
      }
    }
  },
  "components": {
    "schemas": {
      "error500": {
        "type": "object",
        "properties": {
          "correlationId": {
            "type": "string",
            "format": "uuid",
            "example": "bb3a7a80-44ec-4b74-9b7b-c8cd58f777b3"
          },
          "error": {
            "type": "object",
            "properties": {
              "code": {
                "type": "string",
                "example": "E_INTERNAL"
              }
            }
          },
          "payload": {
            "type": "object",
            "properties": {}
          }
        }
      }
    }
  }
}
